{
  "id": "01-single-plot",
  "description": "Single plot at its trigger: 1,000 m2, 30 mm deficit at a 30 mm trigger, 60% efficiency, 12 m3/h.",
  "source": "Idea doc, build addendum golden test 1 (= worked example recommendation, 4 h 10 min)",
  "input": {
    "today": "2026-10-03",
    "pump": {
      "flow": {
        "kind": "rate",
        "value": 12,
        "unit": "m3/h",
        "provenance": "simulated"
      }
    },
    "rain_model": {
      "fraction": 1,
      "ignore_below_mm": 0,
      "provenance": "assumed",
      "source": "fixture: rain is stated as effective rain"
    },
    "plots": [
      {
        "id": "A",
        "label": "Tomatoes",
        "area_m2": {
          "value": 1000,
          "unit": "m2",
          "provenance": "simulated",
          "source": "worked example: quarter acre"
        },
        "method": "furrow",
        "efficiency": {
          "value": 0.6,
          "unit": "fraction",
          "provenance": "table",
          "source": "methods.json furrow"
        },
        "crop": {
          "crop_id": "tomato",
          "stage": "mid",
          "provenance": "simulated"
        },
        "root_depth_m": {
          "value": 0.6,
          "unit": "m",
          "provenance": "assumed",
          "source": "worked example (illustrative; FAO-56 Table 22 range is 0.7-1.5 m)"
        },
        "soil_awc_mm_per_m": {
          "value": 125,
          "unit": "mm/m",
          "provenance": "simulated",
          "source": "worked example: sandy loam"
        },
        "deficit": {
          "mm": 30,
          "as_of": "2026-10-03",
          "provenance": "simulated"
        },
        "rain_since_mm": {
          "value": 0,
          "unit": "mm",
          "provenance": "simulated"
        }
      }
    ]
  },
  "expected": {
    "status": "pump",
    "total_litres": 50000,
    "total_minutes": 250,
    "plots": {
      "A": {
        "status": "due",
        "reason": "at_or_above_trigger",
        "trigger_mm": 30,
        "deficit_mm": 30,
        "requested_litres": 50000,
        "allocated_litres": 50000,
        "unmet_litres": 0,
        "minutes": 250
      }
    }
  }
}
