{
  "id": "03-missing-rain",
  "description": "As 01, but rain since the last update (2026-10-01) is unknown: no minutes, ask for rain since that date.",
  "source": "Idea doc, build addendum golden test 3",
  "input": {
    "today": "2026-10-03",
    "pump": {
      "flow": {
        "kind": "rate",
        "value": 12,
        "unit": "m3/h",
        "provenance": "simulated"
      }
    },
    "rain_model": {
      "fraction": 1,
      "ignore_below_mm": 0,
      "provenance": "assumed",
      "source": "fixture: rain is stated as effective rain"
    },
    "plots": [
      {
        "id": "A",
        "label": "Tomatoes",
        "area_m2": {
          "value": 1000,
          "unit": "m2",
          "provenance": "simulated",
          "source": "worked example: quarter acre"
        },
        "method": "furrow",
        "efficiency": {
          "value": 0.6,
          "unit": "fraction",
          "provenance": "table",
          "source": "methods.json furrow"
        },
        "crop": {
          "crop_id": "tomato",
          "stage": "mid",
          "provenance": "simulated"
        },
        "root_depth_m": {
          "value": 0.6,
          "unit": "m",
          "provenance": "assumed",
          "source": "worked example (illustrative; FAO-56 Table 22 range is 0.7-1.5 m)"
        },
        "soil_awc_mm_per_m": {
          "value": 125,
          "unit": "mm/m",
          "provenance": "simulated",
          "source": "worked example: sandy loam"
        },
        "deficit": {
          "mm": 30,
          "as_of": "2026-10-01",
          "provenance": "simulated"
        },
        "rain_since_mm": null
      }
    ]
  },
  "expected": {
    "status": "paused",
    "question_key": "ask_rain_since",
    "question_params": {
      "since": "2026-10-01"
    },
    "total_litres": 0,
    "total_minutes": 0,
    "plots": {
      "A": {
        "status": "paused",
        "reason": "missing_input",
        "allocated_litres": 0,
        "minutes": 0
      }
    }
  }
}
