{
  "id": "07-worked-example-bucket-test",
  "description": "Worked example end to end: TAW = 125 mm/m x 0.6 m = 75 mm, RAW = 0.4 x 75 = 30 mm; pump measured by bucket test (20 L in 6 s = 200 L/min). Every ~5 days: 50 m3 = 4 h 10 min.",
  "source": "Idea doc, worked example table",
  "input": {
    "today": "2026-10-03",
    "pump": {
      "flow": {
        "kind": "bucket",
        "litres": 20,
        "seconds": 6,
        "provenance": "simulated",
        "source": "worked example"
      }
    },
    "rain_model": {
      "fraction": 1,
      "ignore_below_mm": 0,
      "provenance": "assumed",
      "source": "fixture: rain is stated as effective rain"
    },
    "plots": [
      {
        "id": "A",
        "label": "Tomatoes",
        "area_m2": {
          "value": 1000,
          "unit": "m2",
          "provenance": "simulated",
          "source": "worked example: quarter acre"
        },
        "method": "furrow",
        "efficiency": {
          "value": 0.6,
          "unit": "fraction",
          "provenance": "table",
          "source": "methods.json furrow"
        },
        "crop": {
          "crop_id": "tomato",
          "stage": "mid",
          "provenance": "simulated"
        },
        "root_depth_m": {
          "value": 0.6,
          "unit": "m",
          "provenance": "assumed",
          "source": "worked example (illustrative; FAO-56 Table 22 range is 0.7-1.5 m)"
        },
        "soil_awc_mm_per_m": {
          "value": 125,
          "unit": "mm/m",
          "provenance": "simulated",
          "source": "worked example: sandy loam"
        },
        "deficit": {
          "mm": 30,
          "as_of": "2026-10-03",
          "provenance": "simulated"
        },
        "rain_since_mm": {
          "value": 0,
          "unit": "mm",
          "provenance": "simulated"
        }
      }
    ]
  },
  "expected": {
    "status": "pump",
    "total_litres": 50000,
    "total_minutes": 250,
    "plots": {
      "A": {
        "status": "due",
        "trigger_mm": 30,
        "requested_litres": 50000,
        "minutes": 250
      }
    }
  }
}
